{
  "namespace": "https://id.example.com/org/acme",
  "peerIssuer": "https://id.globex.example/org/globex",
  "jwksUri": "https://id.globex.example/org/globex/jwks",
  "allowedAudiences": ["https://api.example.com/partners"],
  "claimMapping": { "sub": "sub" },
  "popRequirements": ["dpop"],
  "trustStatus": "active",
  "keyRefresh": { "maxStaleSeconds": 3600, "refreshIntervalSeconds": 300 }
}
